{
  "version": 1,
  "pack": "fen_bells",
  "title": "The Bell Beneath the Fen",
  "season": "genforge/seasons/2026-s1.example.json",
  "bible": "genforge/lore/world-bible.md",
  "keyframe": "docs/art/modern-pixel/gloamfen-target.png",
  "style": {
    "id": "fen_bells.style.lumen_nocturne",
    "direction": "Modern hand-clustered pixel art, 3/4 angled top-down, distinct anatomy and materials, deep indigo shadows, moss and bronze, local turquoise Lumen and ivory highlights. Crisp silhouettes; no baked bloom, chibi proportions, blur, or generic recolor-only bosses.",
    "palette": [
      "#080e17",
      "#0e1822",
      "#16232c",
      "#20313a",
      "#2d4249",
      "#3d5358",
      "#54696b",
      "#728582",
      "#9aa59a",
      "#c2c5ad",
      "#edf0d5",
      "#152b2a",
      "#1c3b34",
      "#284d3b",
      "#3b5f47",
      "#577457",
      "#78906a",
      "#a2b88a",
      "#123e42",
      "#175757",
      "#217470",
      "#32968a",
      "#50b5a0",
      "#7ed4ba",
      "#a7eee1",
      "#d7fff2",
      "#251f27",
      "#393039",
      "#514248",
      "#71615d",
      "#968471",
      "#b7a084",
      "#392b22",
      "#55402b",
      "#775734",
      "#987143",
      "#ba9455",
      "#d8b875",
      "#efcf95",
      "#f4e8c1",
      "#262b40",
      "#3e4661",
      "#5e6b87",
      "#8b9bae",
      "#374739",
      "#5a6247",
      "#8a8b64",
      "#c4bf93"
    ],
    "emissive_colors": [
      "#7ed4ba",
      "#a7eee1",
      "#d7fff2",
      "#f4e8c1"
    ],
    "frame_px": 128,
    "max_atlas_bytes": 4194304,
    "max_particles": 192,
    "max_lights": 4
  },
  "lore": [
    {
      "id": "fen_bells.lore.unrung",
      "name": "The Bell That Refused the Gloom",
      "origin": "Gloamfen / Mireborn",
      "story": "When the drowned Haven lost its well, its keepers tied a warning bell to the antlers of Orun. The beast walked the flooded streets for seven nights, calling the living home. On the eighth, the bell fell silent. Now its clapper hangs inside his luminous ribs, and every stranger hears the voice of someone they failed to save. The Gloom made the warning beautiful enough to follow.",
      "discovery": "Discover the sunken bell shrine, then survive Orun's final silence to recover the keeper's account.",
      "links": [
        "fen_bells.creature.orun",
        "fen_bells.lore.widows_refrain"
      ]
    },
    {
      "id": "fen_bells.lore.widows_refrain",
      "name": "The Second Stroke",
      "origin": "Havens / Guilds of the Hunt",
      "story": "Keeper Ilyra carried a crescent blade to cut ferry ropes during the flood. At each rescue she struck the bronze rail twice: once for the living, once for those still beneath the water. Her blade remembers the second stroke. Its echo answers a deliberate melee hit, but it has no edge for another echo to answer.",
      "discovery": "Read the ferry ledger beside the shrine. The second stroke reveals the keeper's signature.",
      "links": [
        "fen_bells.lore.unrung",
        "fen_bells.item.widows_refrain"
      ]
    },
    {
      "id": "fen_bells.lore.pilgrim_bell",
      "name": "The Path Back",
      "origin": "Havens / Lumen wells",
      "story": "The last ferryman wore this bell beneath his cloak so frightened children could find him without seeing the flood. Its note held no command to fight; it meant that someone was still coming back. Hunters who step cleanly through danger hear a fragment of that promise and recover their resolve. The bell takes room where a heavier enchantment might have lived.",
      "discovery": "Find the ferryman's empty mooring; the bell's inscription connects the shrine to the nearest Haven.",
      "links": [
        "fen_bells.lore.widows_refrain",
        "fen_bells.item.pilgrim_bell"
      ]
    },
    {
      "id": "fen_bells.lore.storm_canticle",
      "name": "A Song for Two Spirits",
      "origin": "Gloamfen / Mireborn bonds",
      "story": "A Mireborn kit once followed Ilyra between islands, carrying a silver wire in its teeth. When lightning struck the wire, both spirits answered in the same rhythm. The Canticle keeps that imperfect duet: a hunter's storm can spend a creature's wet mark to leap between enemies. No mark survives the song, and no borrowed strike can begin it again.",
      "discovery": "Bond a Mireborn companion and trace the wire between the three submerged shrines.",
      "links": [
        "fen_bells.lore.pilgrim_bell",
        "fen_bells.item.storm_canticle"
      ]
    },
    {
      "id": "fen_bells.lore.crown_of_return",
      "name": "The First Light Kept",
      "origin": "Gloamfen / Lumen / Guilds of the Hunt",
      "story": "The keepers never crowned a king. They made this circlet for the hunter who returned with everyone accounted for, human and creature alike. Orun hid it beneath the bell shrine before the Gloom learned its shape. Its highest light awakens when a bonded spirit strikes beside its hunter, briefly sheltering the bond. It is called Divine for the vow it preserves, not because its bearer stands above another hunter.",
      "discovery": "Recover the four keeper fragments. The final fragment belongs to the creature that chose to return.",
      "links": [
        "fen_bells.lore.unrung",
        "fen_bells.lore.storm_canticle",
        "fen_bells.item.crown_of_return"
      ]
    }
  ],
  "effects": [
    {
      "id": "fen_bells.effect.returning_cut",
      "name": "The remembered stroke",
      "trigger": "hit",
      "tags": [
        "melee"
      ],
      "requires": [],
      "consumes": [],
      "action": "echo",
      "magnitude_permille": 350,
      "cooldown_ticks": 45,
      "max_targets": 1,
      "budget": 18,
      "vfx": {
        "shape": "crescent",
        "color": "#d8b875",
        "anticipation_ms": 60,
        "impact_ms": 90,
        "dissipate_ms": 420,
        "particles": 18,
        "lights": 1
      }
    },
    {
      "id": "fen_bells.effect.keeper_resolve",
      "name": "The path back",
      "trigger": "dodge",
      "tags": [
        "dodge"
      ],
      "requires": [],
      "consumes": [],
      "action": "resource",
      "magnitude_permille": 150,
      "cooldown_ticks": 90,
      "max_targets": 1,
      "budget": 12,
      "vfx": {
        "shape": "sigil",
        "color": "#7ed4ba",
        "anticipation_ms": 60,
        "impact_ms": 90,
        "dissipate_ms": 420,
        "particles": 24,
        "lights": 1
      }
    },
    {
      "id": "fen_bells.effect.bell_surge",
      "name": "The drowned canticle",
      "trigger": "hit",
      "tags": [
        "storm"
      ],
      "requires": [
        "wet"
      ],
      "consumes": [
        "wet"
      ],
      "action": "chain",
      "magnitude_permille": 250,
      "cooldown_ticks": 90,
      "max_targets": 3,
      "budget": 24,
      "vfx": {
        "shape": "fork",
        "color": "#a7eee1",
        "anticipation_ms": 60,
        "impact_ms": 90,
        "dissipate_ms": 420,
        "particles": 44,
        "lights": 1
      }
    },
    {
      "id": "fen_bells.effect.shared_vigil",
      "name": "The first light kept",
      "trigger": "pet_hit",
      "tags": [
        "pet"
      ],
      "requires": [],
      "consumes": [],
      "action": "ward",
      "magnitude_permille": 250,
      "cooldown_ticks": 150,
      "max_targets": 1,
      "budget": 20,
      "vfx": {
        "shape": "crown",
        "color": "#f4e8c1",
        "anticipation_ms": 60,
        "impact_ms": 90,
        "dissipate_ms": 420,
        "particles": 56,
        "lights": 1
      }
    }
  ],
  "skills": [
    {
      "id": "fen_bells.skill.mire_chime",
      "name": "Mire Chime",
      "role": "setup",
      "tags": [
        "field"
      ],
      "effects": [],
      "lore": "fen_bells.lore.unrung",
      "counterplay": "Pools appear in a crescent, leaving a dry inner lane. Move inside before the bell sounds."
    },
    {
      "id": "fen_bells.skill.storm_toll",
      "name": "Storm Toll",
      "role": "payoff",
      "tags": [
        "storm"
      ],
      "effects": [
        "fen_bells.effect.bell_surge"
      ],
      "lore": "fen_bells.lore.unrung",
      "counterplay": "A rising antler spark points to the wet target. Leave the pool before the three-pronged discharge."
    },
    {
      "id": "fen_bells.skill.reed_step",
      "name": "Reed Step",
      "role": "movement",
      "tags": [
        "dodge"
      ],
      "effects": [
        "fen_bells.effect.keeper_resolve"
      ],
      "lore": "fen_bells.lore.unrung",
      "counterplay": "Orun lowers one antler before a lateral leap. Follow the landing, not the afterimage."
    },
    {
      "id": "fen_bells.skill.antler_refrain",
      "name": "Antler Refrain",
      "role": "payoff",
      "tags": [
        "melee"
      ],
      "effects": [
        "fen_bells.effect.returning_cut"
      ],
      "lore": "fen_bells.lore.unrung",
      "counterplay": "Two asymmetric sweeps: dodge the first, punish the long recovery after the echo."
    },
    {
      "id": "fen_bells.skill.last_vigil",
      "name": "Last Vigil",
      "role": "defense",
      "tags": [
        "pet"
      ],
      "effects": [
        "fen_bells.effect.shared_vigil"
      ],
      "lore": "fen_bells.lore.unrung",
      "counterplay": "The bell goes still and a ward gathers. Strike the exposed chest after the light collapses."
    }
  ],
  "creatures": [
    {
      "id": "fen_bells.creature.orun",
      "name": "Orun, the Last Bellwether",
      "family": "Mireborn",
      "biome": "Gloamfen",
      "tier": "legendary",
      "skills": [
        "fen_bells.skill.mire_chime",
        "fen_bells.skill.storm_toll",
        "fen_bells.skill.reed_step",
        "fen_bells.skill.antler_refrain",
        "fen_bells.skill.last_vigil"
      ],
      "lore": "fen_bells.lore.unrung",
      "art": "fen_bells.art.bellwether",